{
  "record_id": "FR0333.RSI.OBSERVATION.PIPELINE.0001",
  "timestamp": "2026-09-14T00:00:00Z",
  "topic": "bounded_recursive_self_improvement",
  "sources": [
    "openai.research_acceleration.2026-09-06",
    "anthropic.when_ai_builds_itself.2026-09"
  ],
  "claims": {
    "AI.ASSISTS.AI.RESEARCH": "T.20",
    "AI.WRITES.AI.DEVELOPMENT.CODE": "T.20",
    "AI.RUNS.RESEARCH.EXPERIMENTS": "T.20",
    "AI.PROPOSES.HYPOTHESES": "T.20",
    "AI.EVALUATES.AI.RELATED.WORK": "T.20",
    "FULL.AUTONOMOUS.SELF.SUCCESSOR.DESIGN": "U.21",
    "CURRENT.RUNTIME.CAN.SELF.REWRITE.MODEL.WEIGHTS": "F.6"
  },
  "notes": {
    "boundary": "bounded improvement around model operations is established; self-directed runtime model-weight rewriting is not established",
    "runtime_scope": "This repository pipeline upgrades evidence handling, evaluation, and regression controls. It does not modify hosted model weights or platform permissions."
  }
}
